common_name,scientific_name,kingdom,phylum,class,order,family,genus,habitat,diet,lifespan_wild,lifespan_captivity,weight_kg,conservation_status,population_trend,geographic_range,interesting_fact,threats,description,lipaspan_captivity,lipaspan_wild
Adonis,Polyommatus bellargus,Animalia,Arthropoda,Insecta,Lepidoptera,Lycaenidae,Polyommatus,Chalk and limestone grasslands,Herbivore (larvae) — horseshoe vetch; Adults — nectar,1 year (lifecycle),N/A,<0.001 kg,Least Concern,Decreasing,"Europe, Middle East, Central Asia","The Adonis blue butterfly is one of the most vivid blue butterflies in Europe. The intense blue colour is structural, produced by microscopic scales that refract light, not by blue pigment.","Habitat loss (chalk grassland), loss of grazing, climate change","The Adonis blue is a small butterfly. Males have brilliant iridescent blue upperwings with white-fringed edges; females are brown with orange spots. Both sexes have distinctive white-fringed, spotted underwings.",,
African Giant Swallowtail,Papilio antimachus,Animalia,Arthropoda,Insecta,Lepidoptera,Papilionidae,Papilio,Lowland rainforests of Central and West Africa,"Herbivore (larvae) — Entandrophragma; Adults — nectar, minerals",1 year (lifecycle),N/A,<0.001 kg,Not Evaluated,Unknown,Central and West Africa,"The African giant swallowtail is the largest butterfly in Africa and one of the largest in the world, with a wingspan of up to 25 cm. It is toxic — its body contains poison from its larval food plants, deterring predators.",Deforestation,"The African giant swallowtail has a wingspan of up to 25 cm. Its wings are orange-brown with black markings and small, pale spots. It is toxic to predators and rarely collected due to its large size and rarity.",,
African Leopard,Panthera pardus pardus,Animalia,Chordata,Mammalia,Carnivora,Felidae,Panthera,"Savannas, forests, grasslands, mountains","Carnivore — antelopes, baboons, hares, birds",12–17 years,21–23 years,30–90 kg,Vulnerable,Decreasing,Sub-Saharan Africa,Leopards are the strongest climbers among big cats and habitually haul carcasses heavier than themselves up into trees to cache them from lions and hyenas.,"Habitat loss, prey depletion, retaliatory killing, illegal trade","The African leopard is the nominate subspecies of the leopard. It has a pale yellow to golden coat covered with dark rosette spots. It is solitary and nocturnal, with extraordinary adaptability across habitats.",,
American Snoot,Libytheana carinenta,Animalia,Arthropoda,Insecta,Lepidoptera,Libytheidae,Libytheana,"Woodland edges, hackberry groves, stream valleys","Herbivore (larvae) — hackberry; Adults — nectar, sap, mud",1 year (lifecycle),N/A,<0.001 kg,Least Concern,Stable,North and Central America,"Snout butterflies get their name from their elongated labial palps (mouthparts) that extend forward, making the butterfly look as if it has a long snout. These resemble a broken twig and aid in camouflage when at rest.",Hackberry tree loss,"The American snout butterfly has an orange and dark brown upper wing pattern with white forewing spots. When at rest with wings folded, its extended palps make it remarkably resemble a dead leaf on a twig.",,
An 88,Diaethria anna,Animalia,Arthropoda,Insecta,Lepidoptera,Nymphalidae,Diaethria,Tropical rainforests of Central and South America,"Herbivore (larvae) — various plants; Adults — rotting fruit, dung, sap",1 year (lifecycle),N/A,<0.001 kg,Least Concern,Stable,Central and South America,"The '88 butterfly' gets its name from the pattern on its hindwing underside, which resembles the number '88' or '89'. This precise, repeatable pattern has fascinated naturalists and collectors for centuries.",Deforestation,The 88 butterfly has striking blue-black and red upperside wings. The underside of the hindwings displays the famous black-on-white '88' numeral pattern. It is most visible at rest with wings folded.,,
Antelope,Antilopinae spp.,Animalia,Chordata,Mammalia,Artiodactyla,Bovidae,Various,"Savannas, grasslands, deserts, forests","Herbivore — grasses, leaves, shrubs",10–25 years,Up to 30 years,20–900 kg (varies by species),Least Concern,Varies by species,"Africa, Asia, North America",Antelopes can reach speeds of up to 100 km/h and are capable of jumping 3 metres high to escape predators.,"Habitat loss, hunting, competition with livestock","Antelopes are a diverse group of herbivorous mammals in the family Bovidae. Most species are native to Africa. They are characterised by their hollow, unbranched horns and slender, graceful builds.",,
Appollo,Parnassius apollo,Animalia,Arthropoda,Insecta,Lepidoptera,Papilionidae,Parnassius,"Alpine meadows, rocky slopes, subalpine zones",Herbivore (larvae) — stonecrop (Sedum); Adults — nectar from alpine flowers,1 year (lifecycle),N/A,<0.001 kg,Vulnerable,Decreasing,Mountains of Europe and Central Asia,"The apollo butterfly is the only butterfly specifically listed on CITES Appendix II, restricting its international trade. After mating, the male glues a hardened plug (sphragis) to the female's abdomen to prevent her from mating again.","Climate change (shrinking alpine habitat), overgrazing, collection","The apollo is a large, striking butterfly with white wings that are semi-transparent with grey vein patterns, black spots near the wing margins, and distinctive red spots with white centres on the hindwings.",,
Arcigera Flower Moth,Schinia arcigera,Animalia,Arthropoda,Insecta,Lepidoptera,Noctuidae,Schinia,"Prairies, meadows, grasslands with aster plants",Herbivore (larvae) — aster (Symphyotrichum); Adults — nectar,1 year (lifecycle),N/A,<0.001 kg,Least Concern,Unknown,Eastern North America,"Flower moths of the genus Schinia are cryptically coloured to match the specific flower species their larvae feed on. The arcigera flower moth is found almost exclusively on aster flowers, virtually disappearing against the petals.",Prairie habitat loss,"The arcigera flower moth has distinctive pinkish-purple hindwings and mottled, cryptic forewings with pink and grey-brown colouring. It rests on aster flowerheads during the day, relying on camouflage for protection.",,
Asian Green Bee Eater,Merops orientalis,Animalia,Chordata,Aves,Coraciiformes,Meropidae,Merops,"Open country, grasslands, farmlands, light forests","Carnivore — bees, wasps, dragonflies, other flying insects",8–10 years,N/A,0.015–0.018 kg,Least Concern,Stable,"Sub-Saharan Africa, Middle East, South and Southeast Asia","Before eating a bee, the green bee-eater beats it against a branch to remove the sting and squeeze out the venom sac, making the bee safe to eat — a learned behaviour observed across the species.","Habitat loss, pesticide use reducing prey","The Asian green bee-eater is a small, brilliantly coloured bird with emerald-green plumage, a blue chin, black eye mask, chestnut crown and nape, and elongated central tail feathers. It is an aerial insect hunter.",,
Atala,Eumaeus atala,Animalia,Arthropoda,Insecta,Lepidoptera,Lycaenidae,Eumaeus,"Coastal scrub, pine flatwoods with coontie palm",Herbivore (larvae) — coontie (Zamia integrifolia); Adults — nectar,1 year (lifecycle),N/A,<0.001 kg,Near Threatened,Recovering,"South Florida, Cuba, Bahamas","The atala butterfly was thought to be extinct in Florida by the 1960s due to destruction of its host plant, coontie. Conservation of coontie in gardens and parks led to a dramatic recovery, making it one of butterfly conservation's success stories.","Coontie loss, habitat destruction",The atala is a small but spectacular butterfly with iridescent blue-green wings bordered in black above. The underside is black with rows of blue spots and a brilliant red abdomen — warning colours advertising its toxicity from coontie.,,
Atlas Moth,Attacus atlas,Animalia,Arthropoda,Insecta,Lepidoptera,Saturniidae,Attacus,Tropical and subtropical forests,Herbivore (larvae) — various trees; Adults — cannot eat (no functional mouthparts),1–2 weeks (adult),N/A,<0.001 kg,Not Evaluated,Unknown,"South and Southeast Asia, China",The Atlas moth is among the largest moths in the world with a wingspan of up to 30 cm. Adult moths have no functional mouthparts and cannot eat — they survive entirely on fat reserves accumulated as caterpillars and typically live for just 1–2 weeks.,"Deforestation, light pollution","The Atlas moth has enormous, richly patterned wings in rusty red and brown with transparent 'windows' and distinctive snake-head patterns at each forewing tip — thought to deter predators by mimicking the head of a snake.",,
Banded Orange Heliconian,Dryadula phaetusa,Animalia,Arthropoda,Insecta,Lepidoptera,Nymphalidae,Dryadula,"Tropical forests, forest edges, open areas","Herbivore (larvae) — passionflower vines; Adults — nectar, pollen",1 year (lifecycle),N/A,<0.001 kg,Least Concern,Stable,"Central America, South America",Heliconian butterflies can incorporate amino acids from pollen into their diet — an unusual ability for butterflies. This supplementary protein significantly extends their lifespan (up to six months) compared to most butterflies that live only a few weeks.,"Deforestation, loss of passionflower host plants",The banded orange heliconian is a long-winged butterfly with brilliant orange-red wings crossed by bold black bands and bordered in black. Its vivid colouration serves as aposematic warning of its toxicity.,,
Banded Peacock,Papilio tyndaraeus,Animalia,Arthropoda,Insecta,Lepidoptera,Papilionidae,Papilio,"Tropical forests, forest clearings",Herbivore (larvae) — citrus plants; Adults — nectar,1 year (lifecycle),N/A,<0.001 kg,Least Concern,Stable,"Central America, Mexico",The banded peacock butterfly is known to engage in hilltopping — males fly to the tops of hills and tree canopies to establish territories and compete for females who arrive to mate at these elevated vantage points.,Forest habitat loss,"The banded peacock is a large, striking swallowtail with iridescent blue-green wings crossed by a broad black band and decorated with brilliant iridescent scaling that shimmers in changing light.",,
Banded Tiger Moth,Apantesis vittata,Animalia,Arthropoda,Insecta,Lepidoptera,Erebidae,Apantesis,"Fields, meadows, roadsides, forest edges",Herbivore (larvae) — various low-growing plants; Adults — minimal,1 year (lifecycle),N/A,<0.001 kg,Least Concern,Stable,Eastern North America,Tiger moths produce ultrasonic clicks that jam the echolocation signals of hunting bats — a remarkable anti-predator adaptation. The moths with the most vivid warning colours also tend to produce the most effective jamming signals.,"Habitat loss, light pollution",The banded tiger moth has cream-coloured wings crossed by bold black stripes on the forewings and brilliant red-orange hindwings that flash when the moth is disturbed — a startling warning to predators of its toxicity.,,
Bear,Ursidae spp.,Animalia,Chordata,Mammalia,Carnivora,Ursidae,Various,"Forests, mountains, tundra, arctic","Omnivore — fish, berries, honey, insects, mammals",20–25 years,Up to 40 years,27–700 kg (varies by species),Least Concern,Varies by species,"North America, Europe, Asia","Bears are powerful swimmers and some species, such as the polar bear, can swim for hundreds of kilometres without rest.","Habitat loss, poaching, human conflict","Bears are large mammals in the family Ursidae. They have stocky bodies, rounded ears, short tails and strong claws. Most species are omnivorous and several hibernate during winter.",,
Beaver,Castor canadensis,Animalia,Chordata,Mammalia,Rodentia,Castoridae,Castor,"Rivers, lakes, streams, wetlands","Herbivore — bark, leaves, aquatic plants",10–15 years,Up to 24 years,16–32 kg,Least Concern,Stable,North America,Beavers are nature's engineers — their dams create wetland habitats that support hundreds of other species and reduce flooding downstream.,"Trapping, habitat drainage","The North American beaver is the largest rodent in North America. Known for building dams from branches and mud, beavers are semiaquatic with webbed hind feet and a large, flat, paddle-shaped tail.",,
Beckers White,Not yet classified,Animalia,Unknown,Unknown,Unknown,Unknown,Unknown,Various,Unknown,Unknown,Unknown,Unknown,Not Evaluated,Unknown,Unknown,The Beckers White is one of 209 species in the AniX wildlife identification dataset.,Unknown,The Beckers White is included in the AniX training dataset. Detailed biological information will be updated in a future version.,,
Bee,Apis mellifera,Animalia,Arthropoda,Insecta,Hymenoptera,Apidae,Apis,"Meadows, gardens, forests, farmland","Herbivore — nectar, pollen",6 weeks (worker); 2–5 years (queen),N/A,<0.001 kg,Not Evaluated,Decreasing,"Worldwide (domesticated); native to Europe, Africa, Western Asia",Honey bees communicate the location of food sources through a complex 'waggle dance' — a figure-8 movement whose direction and duration encode the direction and distance of flowers from the hive. This is one of the most sophisticated forms of communication in the animal kingdom.,"Pesticides (especially neonicotinoids), habitat loss, pathogens, climate change","The western honey bee is the world's most important commercial pollinator. Workers have pollen baskets on their hind legs, barbed stings, and communicate via the famous waggle dance. They live in highly organised social colonies of up to 80,000 individuals.",,
Bird Cherry Ermine Moth,Yponomeuta evonymella,Animalia,Arthropoda,Insecta,Lepidoptera,Ypsolophidae,Yponomeuta,"Hedgerows, gardens, woodland edges with bird cherry",Herbivore (larvae) — bird cherry leaves; Adults — nectar,1 year (lifecycle),N/A,<0.001 kg,Least Concern,Stable,"Europe, parts of Asia","Colonies of bird cherry ermine moth caterpillars can completely envelop entire trees — sometimes entire hedgerows — in dense silken webbing as they feed, creating ghostly white shrouded landscapes that are spectacular but temporary.",Minimal — pest of ornamental bird cherry trees,"The bird cherry ermine moth has white forewings dotted with rows of small black spots and pale hindwings. Its caterpillars are social web-spinners, covering their host trees in dense communal silk tents while feeding.",,
Bison,Bison bison,Animalia,Chordata,Mammalia,Artiodactyla,Bovidae,Bison,"Grasslands, prairies, open forests","Herbivore — grasses, sedges, shrubs",15–20 years,Up to 25 years,400–900 kg,Near Threatened,Increasing,North America,"American bison once numbered 30–60 million across North America. Hunting reduced them to fewer than 1,000 by the 1890s. Conservation efforts have brought numbers back to around 500,000 today.","Habitat fragmentation, hybridisation with cattle","The American bison is the largest land animal in North America. It has a massive head, high shoulder hump, and shaggy dark-brown fur on the front body that becomes lighter toward the rear.",,
Black Hairstreak,Satyrium pruni,Animalia,Chordata,Insecta,Lepidoptera,Lycaenidae,Satyrium,Woodland rides and edges with blackthorn shrubs,Herbivore (larvae) — blackthorn (Prunus spinosa); Adults — privet and bramble nectar,1 year (lifecycle),N/A,<0.001 kg,Near Threatened,Decreasing,"Europe, parts of Asia","The black hairstreak is one of the rarest butterflies in England, confined to the ancient blackthorn hedges and woodland edges of a small area between Oxford and Peterborough. Adults spend much of their short lives in the tree canopy.","Habitat loss, blackthorn removal, lack of woodland management","The black hairstreak is a small, dark butterfly with orange-spotted hindwings and a fine hairstreak line on the underside. It is inconspicuous and sedentary, spending most of its time in blackthorn canopy.",,
Blackbird,Turdus merula,Animalia,Chordata,Aves,Passeriformes,Turdidae,Turdus,"Woodland, gardens, parks, farmland","Omnivore — earthworms, berries, insects, seeds",2–3 years,Up to 20 years,0.08–0.125 kg,Least Concern,Decreasing,"Europe, Asia, North Africa; introduced in Australia, New Zealand","Male blackbirds are renowned for their complex, melodic song — one of the most varied and beautiful of any European bird. They often sing at dawn and dusk, and can incorporate sounds from their environment into their songs.","Cat predation, habitat loss, pesticide reduction of invertebrates",The common blackbird is a member of the thrush family. The male has all-black plumage with a bright yellow-orange beak and eye-ring; the female is brown with streaked underparts. It is one of the most familiar garden birds in Europe.,,
Blue Morpho,Morpho peleides,Animalia,Arthropoda,Insecta,Lepidoptera,Nymphalidae,Morpho,Tropical rainforests of Central and South America,"Herbivore (larvae) — legumes; Adults — rotting fruit, tree sap, fungi",1 year (lifecycle),N/A,<0.001 kg,Least Concern,Stable,Mexico to Colombia,The blue morpho's wings contain no blue pigment — the brilliant iridescent blue is created by microscopic light-refracting scales. This structural colour is so intense that it is visible from aircraft flying over the rainforest canopy.,"Deforestation, collection","The blue morpho is one of the world's most spectacular butterflies, with a wingspan of 12–20 cm and wings of brilliant iridescent blue above. The undersides are cryptic brown with eyespots — when flying, the alternating blue/brown creates a flickering camouflage.",,
Blue Spotted Crow,Euploea midamus,Animalia,Arthropoda,Insecta,Lepidoptera,Nymphalidae,Euploea,"Tropical and subtropical forests, gardens",Herbivore (larvae) — various plants; Adults — nectar,1 year (lifecycle),N/A,<0.001 kg,Least Concern,Stable,South and Southeast Asia,"Crow butterflies sequester toxic alkaloids from their larval host plants, making themselves unpalatable to predators. Males gather minerals from moist soil and decaying matter to produce pheromones for mating.",Deforestation,"The blue-spotted crow is a dark brown to black butterfly with rows of white and blue spots on its wings. It flies slowly with shallow wingbeats, advertising its unpalatability with conspicuous colouring.",,
Brookes Birdwing,Not yet classified,Animalia,Unknown,Unknown,Unknown,Unknown,Unknown,Various,Unknown,Unknown,Unknown,Unknown,Not Evaluated,Unknown,Unknown,The Brookes Birdwing is one of 209 species in the AniX wildlife identification dataset.,Unknown,The Brookes Birdwing is included in the AniX training dataset. Detailed biological information will be updated in a future version.,,
Brown Argus,Aricia agestis,Animalia,Arthropoda,Insecta,Lepidoptera,Lycaenidae,Aricia,"Chalk and limestone grasslands, heathland, coastal areas",Herbivore (larvae) — rock-rose (Helianthemum); Adults — small flowers,1 year (lifecycle),N/A,<0.001 kg,Least Concern,Stable,"Europe, Western Asia","The brown argus has expanded its range significantly northward in recent decades due to climate warming, colonising sites further north in Britain and Europe than it previously occupied — making it one of the 'climate change winner' species.","Loss of chalk grassland, habitat fragmentation","The brown argus is a small butterfly, brown on both sides (unlike the common blue). Orange lunules border both wing edges, and the underside has distinctive orange and black spots on a greyish-brown background.",,
Brown Bear,Ursus arctos,Animalia,Chordata,Mammalia,Carnivora,Ursidae,Ursus,"Forests, mountains, tundra, river valleys","Omnivore — fish, berries, roots, small mammals",20–30 years,Up to 50 years,80–600 kg,Least Concern,Stable,"North America, Europe, Asia","Brown bears can run at speeds up to 56 km/h despite their size, and they can consume up to 20,000 calories per day to prepare for winter hibernation.","Habitat loss, poaching, human conflict","The brown bear is one of the largest living carnivores on land. It has a large head with a concave facial profile, prominent shoulder hump, and long front claws used for digging roots and catching fish.",,
Brown Headed Barbet,Psilopogon zeylanicus,Animalia,Chordata,Aves,Piciformes,Megalaimidae,Psilopogon,"Forest edges, gardens, orchards, parks","Frugivore/Omnivore — fruits, berries, insects",6–8 years,N/A,0.09–0.11 kg,Least Concern,Stable,Indian subcontinent,"The brown-headed barbet makes its nest by excavating a hole in a dead tree branch. It produces a loud, repetitive 'kutroo-kutroo' call often described as similar to a water pump, which can be heard for several hundred metres.","Habitat loss, deforestation","The brown-headed barbet is a plump, green bird with a brown streaked head and throat, bright orange patches around its eyes and bill, and a heavy, pale yellow bill with bristles at the base — typical of barbets.",,
Brown Siproeta,Siproeta epaphus,Animalia,Arthropoda,Insecta,Lepidoptera,Nymphalidae,Siproeta,"Tropical and subtropical forests, forest edges","Herbivore (larvae) — Ruellia; Adults — rotting fruit, nectar, bird droppings",1 year (lifecycle),N/A,<0.001 kg,Least Concern,Stable,Mexico through Central America to Peru and Bolivia,Siproeta butterflies are known for their habit of following army ant swarms to feed on other insects flushed out by the ants — a behaviour called 'army ant following' that is more commonly associated with birds.,Deforestation,"The brown siproeta is a medium-large butterfly with warm brown wings patterned with white and pale yellow patches. It has a distinctively broad, rounded wing shape and a graceful, gliding flight style.",,
Buffalo,Syncerus caffer,Animalia,Chordata,Mammalia,Artiodactyla,Bovidae,Syncerus,"Savannas, woodlands, floodplains, forests","Herbivore — grasses, sedges",15–22 years,Up to 29 years,300–900 kg,Least Concern,Decreasing,Sub-Saharan Africa,African buffalo are known for their remarkable memory and group cohesion — the herd will collectively vote on which direction to move by standing and facing the desired direction.,"Habitat loss, disease, hunting","The African buffalo, or Cape buffalo, is a large sub-Saharan African bovine. It has a fused, helmet-like horn boss that distinguishes it from other bovids. It is considered one of Africa's most dangerous animals.",,
Bull,Bos taurus,Animalia,Chordata,Mammalia,Artiodactyla,Bovidae,Bos,"Grasslands, farmlands, pastures","Herbivore — grasses, hay, grain",15–20 years,20–25 years,500–1000 kg,Not Evaluated,Stable,Worldwide (domesticated),"Domestic cattle were domesticated from the extinct aurochs around 10,000 years ago in the Near East and independently in India and Africa.",Minimal — domesticated,A bull is an intact adult male domestic bovine. Bulls are heavily muscled with thick necks and broad foreheads. They are used in agriculture for draft work and in selective breeding.,,
Butterfly,Lepidoptera spp.,Animalia,Arthropoda,Insecta,Lepidoptera,Various,Various,Virtually all terrestrial habitats,"Herbivore (larvae) — plants; Adults — nectar, fruit, salts, minerals","2 weeks–6 months (adult, varies by species)",N/A,<0.001 kg,Least Concern,Decreasing,Worldwide except Antarctica,Butterflies taste with their feet — they have chemoreceptors on their tarsi (feet) that detect sugar and other chemicals when they land on a leaf or flower. This helps them quickly assess whether a plant is a suitable food source or egg-laying site.,"Habitat loss, pesticides, climate change","Butterflies are a large group of insects in the order Lepidoptera distinguished by scaled wings and diurnal activity. They undergo complete metamorphosis through four stages: egg, caterpillar, chrysalis, and adult.",,
Cabbage White,Pieris rapae,Animalia,Arthropoda,Insecta,Lepidoptera,Pieridae,Pieris,"Gardens, fields, farmland, roadsides","Herbivore (larvae) — cabbage, broccoli, mustard plants; Adults — nectar",3–4 weeks (adult),N/A,<0.001 kg,Least Concern,Stable,Originally Europe and Asia; now worldwide except Antarctica (invasive),"The small white butterfly is one of the most successful insects in the world, having spread to every inhabited continent from its native Europe. It was accidentally introduced to Australia in 1929 and North America in the 1860s via transport of its host plants.",None — abundant,The small white (cabbage white) butterfly has off-white wings with dark wing tips and (in females) two dark spots on the forewing. Its larvae are agricultural pests of brassica crops. It is among the most common butterflies globally.,,
Cairns Birdwing,Ornithoptera euphorion,Animalia,Arthropoda,Insecta,Lepidoptera,Papilionidae,Ornithoptera,"Tropical rainforests of North Queensland, Australia",Herbivore (larvae) — Aristolochia vines; Adults — nectar from flowers,1 year (lifecycle),N/A,<0.001 kg,Least Concern,Stable,"Northeast Queensland, Australia",The Cairns birdwing is Australia's largest butterfly with a wingspan up to 17 cm. It is legally protected in Australia. Planting its host vine (Aristolochia) in gardens has helped support urban populations in Cairns and surroundings.,"Habitat loss, urban development","The male Cairns birdwing is one of the world's most striking butterflies, with brilliant metallic green, yellow and black wings. Females are larger but less colourful, with black and white-spotted wings.",,
Camel,Camelus dromedarius,Animalia,Chordata,Mammalia,Artiodactyla,Camelidae,Camelus,"Deserts, arid and semi-arid regions","Herbivore — dry grasses, shrubs, thorny plants",40–50 years,Up to 50 years,400–690 kg,Not Evaluated,Stable,"Middle East, North Africa, South Asia (domesticated)",A camel's hump stores up to 36 kg of fat — not water — which can be metabolised for energy and water when food and drink are scarce.,Minimal — domesticated; feral populations managed,The dromedary or Arabian camel has a single hump and is one of the most recognisable animals on Earth. It is adapted to extreme desert environments with the ability to endure long periods without food or water.,,
