common_name,scientific_name,kingdom,phylum,class,order,family,genus,habitat,diet,lifespan_wild,lifespan_captivity,weight_kg,conservation_status,population_trend,geographic_range,interesting_fact,threats,description,lipaspan_captivity,lipaspan_wild
Deer,Cervidae spp.,Animalia,Chordata,Mammalia,Artiodactyla,Cervidae,Various,"Forests, grasslands, mountains, wetlands","Herbivore — grasses, leaves, bark, berries",6–14 years,Up to 20 years,9–300 kg (varies by species),Least Concern,Stable,Worldwide except Australia and Antarctica,"Male deer (stags or bucks) grow and shed antlers annually — the fastest growing tissue in the animal kingdom, growing up to 2.5 cm per day.","Hunting, habitat loss, vehicle collisions","Deer are ruminant mammals in the family Cervidae. Most male deer grow antlers. They are characterised by their slender legs, short tails, and large eyes. Over 40 species exist across diverse habitats worldwide.",,
Dog,Canis lupus familiaris,Animalia,Chordata,Mammalia,Carnivora,Canidae,Canis,All environments (domesticated),"Omnivore — meat, plant matter",1–5 years (feral),10–13 years,1–90 kg (varies by breed),Not Evaluated,Stable,Worldwide,"Dogs were the first animals to be domesticated by humans, approximately 15,000–40,000 years ago from grey wolves. They have co-evolved with humans and can read human social cues.",None — domesticated,"The domestic dog is a domesticated descendant of the wolf. With over 400 recognized breeds, dogs vary enormously in size, shape, and coat. They are highly social pack animals that have formed close bonds with humans.",,
Dolphin,Delphinus delphis,Animalia,Chordata,Mammalia,Cetacea,Delphinidae,Delphinus,"Open oceans, coastal waters, estuaries","Carnivore — fish, squid, crustaceans",25–30 years,Up to 40 years,70–110 kg,Least Concern,Decreasing,Worldwide in tropical and temperate oceans,Dolphins sleep with one eye open and one brain hemisphere active at a time — a state called unihemispheric slow-wave sleep — allowing them to keep breathing consciously.,"Bycatch, pollution, habitat degradation","The common dolphin is a small cetacean with a sleek, streamlined body, distinctive hourglass colouring on its sides, and a long, narrow beak. It is highly social, living in groups (superpods) of thousands.",,
Donkey,Equus africanus asinus,Animalia,Chordata,Mammalia,Perissodactyla,Equidae,Equus,Arid and semi-arid areas (domesticated),"Herbivore — grasses, hay, shrubs",25–30 years,Up to 50 years,80–480 kg,Not Evaluated,Stable,Worldwide (domesticated),"Donkeys have an excellent memory and can recognise other donkeys they met up to 25 years earlier. They are also known to be more cautious than horses, refusing to put themselves in danger.",None — domesticated,"The domestic donkey is a member of the horse family. It has long ears, a short mane, and a thick hide resistant to harsh weather. Used for centuries as a working animal, it is renowned for its stubbornness and endurance.",,
Dragonfly,Libellula depressa,Animalia,Arthropoda,Insecta,Odonata,Libellulidae,Libellula,"Ponds, lakes, marshes, rivers, streams","Carnivore — mosquitoes, flies, gnats, other insects",1–4 years (nymph); 2–4 weeks (adult),N/A,<0.001 kg,Least Concern,Decreasing,"Europe, Western Asia","Dragonflies are the most effective hunters in the animal kingdom — they catch up to 95% of their prey attempts. They track individual prey in a swarm, calculate the prey's trajectory, and intercept it — rather than chasing it — using a unique predictive flight strategy.","Wetland loss, water pollution, pesticide use","The broad-bodied chaser is a stocky dragonfly. Males have a powder-blue abdomen; females and immatures have a yellow-sided brown abdomen. It is an aggressive, territorial hunter typically seen perching beside still water.",,
Duck,Anas platyrhynchos,Animalia,Chordata,Aves,Anseriformes,Anatidae,Anas,"Lakes, ponds, rivers, wetlands, parks","Omnivore — aquatic plants, seeds, insects, molluscs, fish",5–10 years,Up to 20 years,0.72–1.6 kg,Least Concern,Stable,"Nearly worldwide (introduced to Australia, New Zealand, South America)","A duck's quack doesn't echo — this is actually a myth. Scientists have recorded and analysed duck quacks and confirmed they do produce echoes, but the sound fades at both ends, making it difficult to hear in natural settings.","Habitat loss, hunting, lead poisoning from shot","The mallard is the most familiar and widespread dabbling duck. Males have an iridescent green head, yellow bill, chestnut chest, and a distinctive curled tail feather; females are mottled brown with orange bills.",,
Eagle,Aquila chrysaetos,Animalia,Chordata,Aves,Accipitriformes,Accipitridae,Aquila,"Mountains, forests, open grasslands","Carnivore — rabbits, hares, squirrels, fish, birds",30 years,Up to 50 years,2.5–6.5 kg,Least Concern,Stable,"North America, Europe, Asia, North Africa","The golden eagle can dive at speeds exceeding 300 km/h when hunting, and its eyesight is four to eight times more powerful than a human's.","Habitat loss, electrocution from power lines, poisoning",The golden eagle is one of the most widely distributed eagles on Earth. It has dark brown plumage with a golden-brown crown and nape. It is a powerful predator known for its agility and speed in flight.,,
Eastern Coma,Polygonia comma,Animalia,Arthropoda,Insecta,Lepidoptera,Nymphalidae,Polygonia,"Moist woodlands, forest edges, streamsides","Herbivore (larvae) — nettles, elm, hops; Adults — sap, rotting fruit, nectar",1 year (lifecycle),N/A,<0.001 kg,Least Concern,Stable,Eastern North America,"The comma and related angle-wing butterflies (Polygonia) have ragged, irregular wing edges that perfectly mimic dead leaves — complete with apparent holes and bite marks. The underside of the wing is cryptically leaf-brown; the tiny silver 'comma' on the hindwing is the only distinguishing mark.",Habitat loss,"The eastern comma is a medium butterfly with orange upperwings marked with black spots and angular, deeply scalloped wing edges. The underside is cryptic brown with a small silver comma-shaped mark on the hindwing.",,
Eastern Dapple White,Euchloe ausonia,Animalia,Arthropoda,Insecta,Lepidoptera,Pieridae,Euchloe,"Meadows, scrubland, rocky slopes with crucifers","Herbivore (larvae) — wild mustard, garlic mustard; Adults — nectar",1 year (lifecycle),N/A,<0.001 kg,Least Concern,Stable,"Europe, Middle East, Central Asia","Marbled whites and dapple whites have intricate green mosaic patterns on their wing undersides that are completely invisible from above. When they close their wings at rest in grass or flowers, they become virtually invisible.",Habitat loss,"The eastern dappled white is a small butterfly with white wings above, marked with black spots on the forewing tip. The hindwing underside is beautifully marbled with green and white, providing perfect camouflage among vegetation.",,
Eastern Pine Elfin,Incisalia niphon,Animalia,Arthropoda,Insecta,Lepidoptera,Lycaenidae,Incisalia,"Pine woodlands, forest edges",Herbivore (larvae) — young pine needles; Adults — blueberry and other spring flowers,1 year (lifecycle),N/A,<0.001 kg,Least Concern,Decreasing,Eastern North America,"Eastern pine elfin caterpillars feed on young pine needles and are camouflaged to match pine needles exactly in colour, texture, and orientation — lying along needles rather than across them. Even their droppings resemble pine debris.","Loss of young pine stands, fire suppression","The eastern pine elfin is a small butterfly with irregular brownish-grey wings patterned with darker bands and scalloped edges. The patterning is intricate, providing camouflage against pine bark. It flies only briefly in early spring.",,
Elbowed Pierrot,Caleta elna,Animalia,Arthropoda,Insecta,Lepidoptera,Lycaenidae,Caleta,"Open forests, forest edges, gardens, scrubland",Herbivore (larvae) — various plants; Adults — nectar,1 year (lifecycle),N/A,<0.001 kg,Least Concern,Stable,South and Southeast Asia,"Pierrots are named after the white-faced Commedia dell'arte character Pierrot, because their black-on-white wing pattern resembles his costume. They are known for resting with wings flat open — unlike most hairstreak relatives.",Habitat loss,"The elbowed pierrot is a small butterfly, white above with a black costal border and distinctive bent (elbowed) black marking at the forewing apex. The underside has bold black spots on a white background.",,
Elephant,Loxodonta africana,Animalia,Chordata,Mammalia,Proboscidea,Elephantidae,Loxodonta,"Savannas, forests, deserts, wetlands","Herbivore — grass, fruit, bark, roots",60–70 years,Up to 80 years,"3,000–6,000 kg",Vulnerable,Decreasing,Sub-Saharan Africa,"Elephants are the only animals that cannot jump. They also grieve their dead — examining bones and tusks of deceased herd members, sometimes standing silently for hours.","Ivory poaching, habitat loss, human conflict","The African bush elephant is the largest living land animal. It has a long prehensile trunk used for breathing, smelling, drinking, and grasping, plus large fan-shaped ears that help regulate body temperature.",,
Emperor Gum Moth,Opodiphthera eucalypti,Animalia,Arthropoda,Insecta,Lepidoptera,Saturniidae,Opodiphthera,Eucalyptus forests and woodlands of Australia,"Herbivore (larvae) — eucalyptus, pepper trees; Adults — cannot eat",1 year (lifecycle),N/A,<0.001 kg,Least Concern,Stable,Australia,"The emperor gum moth is one of Australia's largest and most spectacular moths. Like all saturniid moths, adults have vestigial mouthparts and cannot eat. They survive their adult life entirely on fat reserves accumulated as caterpillars and typically live only 1–2 weeks.","Habitat loss, light pollution","The emperor gum moth is a large moth with a wingspan up to 15 cm. Its wings are red-brown with a distinctive eyespot on each wing, a white-edged pink and black marginal band, and a pale, pinkish-white forewing costal region.",,
Falcon,Falco peregrinus,Animalia,Chordata,Aves,Falconiformes,Falconidae,Falco,"Open country, tundra, cliffs, cities","Carnivore — birds, bats, small mammals",13 years,Up to 25 years,0.3–1.5 kg,Least Concern,Increasing,Worldwide except Antarctica,"The peregrine falcon is the fastest animal on Earth, reaching speeds exceeding 390 km/h in a hunting dive (stoop) — faster than a Formula 1 racing car.","Pesticide use (historically), habitat disturbance","The peregrine falcon has a blue-grey back, barred white underparts, and a distinctive black hood. It is a master aerial predator, striking prey mid-air after breathtaking high-speed dives.",,
Ferret,Mustela putorius furo,Animalia,Chordata,Mammalia,Carnivora,Mustelidae,Mustela,"Domesticated; grasslands, forests in wild","Carnivore — rodents, rabbits, birds",1–3 years (escaped),7–10 years,0.7–2 kg,Not Evaluated,Stable,Worldwide (domesticated),Ferrets can sleep so deeply that they appear dead and cannot be woken — a state known as 'ferret dead sleep'. They also communicate happiness by performing a bouncy dance called the 'weasel war dance'.,None — domesticated,"The domestic ferret is a small, elongated carnivore with a long tail, short legs, and characteristic musk glands. Despite their small size, ferrets are curious, playful, and highly energetic.",,
Fish,Actinopterygii spp.,Animalia,Chordata,Actinopterygii,Various,Various,Various,"Oceans, rivers, lakes, estuaries","Varies — carnivore, herbivore, omnivore",1–150 years (varies by species),Varies,"<0.001–2,000 kg (varies)",Least Concern,Varies by species,Worldwide aquatic environments,"Fish have been on Earth for over 500 million years — predating the dinosaurs by 300 million years. Some species, like the Greenland shark, can live for over 400 years.","Overfishing, pollution, climate change, habitat destruction","Fish are aquatic vertebrates with gills, fins, and (usually) scales. They are the most species-rich group of vertebrates with over 33,000 known species occupying virtually every aquatic environment on Earth.",,
Flamingo,Phoenicopterus roseus,Animalia,Chordata,Aves,Phoenicopteriformes,Phoenicopteridae,Phoenicopterus,"Shallow saline lakes, lagoons, mangroves, tidal flats","Filter feeder — algae, brine shrimp, insects",20–30 years,Up to 50 years,2–4 kg,Least Concern,Stable,"Africa, southern Europe, Middle East, South Asia",Flamingos get their pink colour from carotenoid pigments in their food. A flamingo fed a white diet would gradually become white. Flamingos in zoos are fed specially supplemented feed.,"Habitat loss, water pollution, human disturbance","The greater flamingo is the largest and most widespread flamingo species. It has pale pink plumage, a distinctive downward-bent bill, and extraordinarily long legs. They often stand on one leg to conserve body heat.",,
Forest Wagtail,Dendronanthus indicus,Animalia,Chordata,Aves,Passeriformes,Motacillidae,Dendronanthus,"Deciduous and evergreen forests, forest edges","Insectivore — insects, invertebrates",3–5 years,N/A,0.015–0.020 kg,Least Concern,Stable,"East and South Asia, wintering in Southeast Asia and India","Unlike all other wagtails that wag their tail up and down, the forest wagtail wags its tail from side to side — an unusual behaviour that is unique within its family and may help flush insects from the forest floor.",Deforestation,"The forest wagtail is an olive-grey and white bird with two distinctive dark breast bands and a pink-buff bill. It is often seen walking on forest floors, swaying its tail sideways as it searches for insects.",,
Fox,Vulpes vulpes,Animalia,Chordata,Mammalia,Carnivora,Canidae,Vulpes,"Forests, grasslands, mountains, deserts, urban areas","Omnivore — rodents, rabbits, birds, fruits, insects",3–4 years,10–12 years,2.2–14 kg,Least Concern,Stable,Widest range of any carnivore — worldwide,"Red foxes are highly adaptable and have colonised every continent except Antarctica. Urban foxes in cities have larger brains than their rural counterparts, an adaptation to navigating complex environments.","Hunting, trapping, road traffic","The red fox is the largest true fox with a distinctive rusty-red coat, white underparts, and a bushy white-tipped tail. It is highly intelligent, omnivorous, and exceptionally adaptable to diverse environments.",,
Frog,Rana temporaria,Animalia,Chordata,Amphibia,Anura,Ranidae,Rana,"Ponds, lakes, rivers, damp forests, meadows","Carnivore — insects, worms, slugs, small fish",5–10 years,Up to 15 years,0.02–0.08 kg,Least Concern,Stable,"Europe, parts of Asia","Frogs absorb water through their skin rather than drinking it. Their skin is so permeable that toxic chemicals in their environment can quickly affect them, making frogs important environmental indicators.","Habitat loss, pollution, climate change, disease (chytridiomycosis)","The common frog is a widespread European amphibian with moist, smooth skin that ranges in colour from brown and grey to yellow-green. It hibernates underwater in winter and congregates at ponds to breed in early spring.",,
Garden Tiger Moth,Arctia caja,Animalia,Arthropoda,Insecta,Lepidoptera,Erebidae,Arctia,"Gardens, hedgerows, moorland, woodland edges",Herbivore (larvae) — wide range of plants; Adults — minimal,1 year (lifecycle),N/A,<0.001 kg,Least Concern,Decreasing,"Europe, Asia, North America","The garden tiger moth has declined by 89% in the UK since 1968 — one of the most dramatic declines of any British moth. Climate change (milder, wetter winters) is thought to be the primary driver, as its hairy caterpillars are vulnerable to wet conditions.","Climate change, habitat loss, light pollution","The garden tiger moth is one of the most distinctive British moths — creamy-white forewings boldly patterned with dark brown patches, and brilliant orange-red hindwings with large blue-centred black spots. The colours warn of foul taste.",,
Giant Leopard Moth,Hypercompe scribonia,Animalia,Arthropoda,Insecta,Lepidoptera,Erebidae,Hypercompe,"Gardens, roadsides, forest edges across eastern North America","Herbivore (larvae) — dandelion, plantain, sunflower; Adults — minimal",1 year (lifecycle),N/A,<0.001 kg,Least Concern,Stable,Eastern North America,"The giant leopard moth caterpillar (woolly bear) curls into a ball when threatened, exposing its brilliant red abdomen between its black body rings — warning predators that it is toxic. Adults are entirely white with hollow black spots, producing a different warning signal.","Habitat loss, pesticide use","The giant leopard moth is a large, striking white moth with bold, hollow black spots and rings on its wings, and an iridescent blue-black body with red and orange markings. Its wings span up to 9 cm.",,
Giraffe,Giraffa camelopardalis,Animalia,Chordata,Mammalia,Artiodactyla,Giraffidae,Giraffa,"Savannas, woodlands, grasslands","Herbivore — leaves (especially acacia), flowers, fruits",20–25 years,Up to 35 years,"750–1,270 kg",Vulnerable,Decreasing,Sub-Saharan Africa,"A giraffe's neck is approximately 1.8 metres long but contains only seven vertebrae — the same number as humans. Its tongue is around 45 cm long and is bluish-purple, possibly to prevent sunburn.","Habitat loss, poaching, civil unrest","The giraffe is the world's tallest living terrestrial animal. Its distinctive feature is its exceptionally long neck and legs. It has an irregular, patchwork coat pattern that is unique to each individual.",,
Glittering Sapphire,Lasaia agesilas,Animalia,Arthropoda,Insecta,Lepidoptera,Riodinidae,Lasaia,"Tropical forests, forest clearings","Herbivore (larvae) — various plants; Adults — nectar, minerals",1 year (lifecycle),N/A,<0.001 kg,Least Concern,Stable,Texas through Central America to South America,"Metal mark butterflies (family Riodinidae) are named for the metallic-looking spots on their wings. The glittering sapphire produces vivid iridescent blue colouration through structural colour — microscopic structures that refract light, similar to the blue morpho.",Deforestation,"The glittering sapphire is a small butterfly with brilliant iridescent blue wings in males (females are less vivid) with dark brown borders. The metallic shimmer changes intensity with viewing angle, making it one of the most dazzling small butterflies.",,
Goat,Capra aegagrus hircus,Animalia,Chordata,Mammalia,Artiodactyla,Bovidae,Capra,"Mountains, grasslands, scrublands (domesticated)","Herbivore — leaves, stems, shrubs, grains",10–15 years,15–18 years,20–90 kg,Not Evaluated,Stable,Worldwide (domesticated),"Goats have rectangular pupils that give them a 320-degree field of view without moving their heads, compared to about 185 degrees for humans — ideal for watching for predators while grazing.",None — domesticated,"The domestic goat is a subspecies of the wild goat. It is one of the earliest domesticated animals. Goats are agile, curious, and intelligent, with both sexes potentially bearing horns and wattles.",,
Gold Banded,Coelites euptychioides,Animalia,Arthropoda,Insecta,Lepidoptera,Nymphalidae,Coelites,Tropical and subtropical forests,"Herbivore (larvae) — various plants; Adults — rotting fruit, sap",1 year (lifecycle),N/A,<0.001 kg,Least Concern,Stable,Southeast Asia,"Gold-banded butterflies are typically found in dark forest understorey environments where shafts of light illuminate the forest floor. Males are territorial and perch on leaves in patches of light, chasing other males that enter their territory.",Deforestation,"The gold-banded butterfly is a dark butterfly with a distinctive broad, bright yellow-gold band crossing its wings. It has a slow, flapping flight through dark forest understorey and rests with wings outspread.",,
Goldfish,Carassius auratus,Animalia,Chordata,Actinopterygii,Cypriniformes,Cyprinidae,Carassius,"Freshwater ponds, rivers (and captivity)","Omnivore — algae, insects, crustaceans, plant matter",Up to 25 years,10–15 years,0.1–3 kg,Least Concern,Stable,East Asia (native); worldwide (domesticated),"Goldfish have a memory span of at least three months — the '3-second memory' is a myth. They can recognise their owners, learn simple tasks, and remember them months later.",Minimal — domesticated; wild populations threatened by invasives,"The goldfish is one of the earliest fish to be domesticated. Originally a grey-green wild carp from East Asia, centuries of selective breeding have produced hundreds of varieties in a rainbow of colours and body shapes.",,
Goose,Anser anser,Animalia,Chordata,Aves,Anseriformes,Anatidae,Anser,"Wetlands, grasslands, farmland","Herbivore — grass, grain, aquatic plants",10–15 years,Up to 25 years,2.5–4.1 kg,Least Concern,Stable,"Europe, Asia, North America","Geese mate for life and form strong pair bonds. If one partner dies, the surviving goose may mourn and remain alone for an extended period before choosing a new partner.","Hunting, habitat loss","The greylag goose is the ancestor of most domestic geese. It has a large orange bill, pale orange-pink legs, and grey-brown plumage with a white belly. It forms large, noisy flocks and migrates seasonally.",,
Gorilla,Gorilla gorilla,Animalia,Chordata,Mammalia,Primates,Hominidae,Gorilla,"Tropical rainforests, swamps, montane forests","Herbivore — leaves, stems, fruit, shoots, bark",35–40 years,Up to 55 years,70–200 kg,Critically Endangered,Decreasing,Central and West Africa,Gorillas are highly intelligent great apes that build nests each night to sleep in. They have been taught sign language in captivity and can communicate using hundreds of signs.,"Deforestation, poaching, disease, armed conflict","The western gorilla is the world's largest living primate. It has a stocky body, broad chest, and strong arms longer than its legs. Adult males develop a silver-grey back (silverbacks) as they mature.",,
Grasshopper,Locusta migratoria,Animalia,Arthropoda,Insecta,Orthoptera,Acrididae,Locusta,"Grasslands, savannas, croplands, wetland margins","Herbivore — grasses, cereal crops, vegetables",3–5 months,N/A,<0.001 kg,Least Concern,Varies,"Africa, Asia, Australia, southern Europe","Migratory locusts can form swarms of billions that darken the sky for hours. A 1-km² swarm contains around 80 million individuals that eat 35,000 people's worth of food daily. Desert locust swarms cover up to 460,000 km² and travel 130 km in a day.",Pesticide use (ironically a threat to non-pest grasshopper species),"The migratory locust (in its solitary phase) is a typical green-brown grasshopper. Triggered by crowding, it transforms into the gregarious phase with a distinctive yellow and black pattern and forms massive, devastating swarms.",,
Great Eggfly,Hypolimnas bolina,Animalia,Arthropoda,Insecta,Lepidoptera,Nymphalidae,Hypolimnas,"Forests, gardens, forest margins, coastal scrub","Herbivore (larvae) — Portulaca and various plants; Adults — nectar, fruit",1 year (lifecycle),,<0.001 kg,Least Concern,Stable,Widespread from Madagascar through South and Southeast Asia to Pacific Islands,"The great eggfly is one of the world's most widespread butterflies but shows remarkable variation across its range — populations on different islands have evolved independently into distinct-looking forms, some mimicking different toxic butterflies locally.",Deforestation,"Male great eggflies are spectacular — velvety black with three pairs of large white spots ringed in iridescent purple-blue. Females are highly variable, often mimicking other butterfly species. It is one of the most widespread Nymphalid butterflies.",N/A,
Great Jay,Graphium xenocles,Animalia,Arthropoda,Insecta,Lepidoptera,Papilionidae,Graphium,Tropical forests of South and Southeast Asia,"Herbivore (larvae) — Uvaria and related plants; Adults — nectar, minerals",1 year (lifecycle),N/A,<0.001 kg,Least Concern,Stable,South and Southeast Asia,Jay swallowtail butterflies (Graphium species) are fast-flying and often found mud-puddling in large groups alongside other species. Males gather at damp soil to extract sodium and minerals essential for reproduction.,Deforestation,"The great jay is a large swallowtail butterfly, dark brown-black above with vivid blue-green iridescent markings across both wings — appearing to glow in forest light. It has an elegant, rapid flight through the rainforest canopy.",,
Green Celled Cattleheart,Parides sesostris,Animalia,Arthropoda,Insecta,Lepidoptera,Papilionidae,Parides,Tropical forests of Central and South America,Herbivore (larvae) — Aristolochia vines; Adults — nectar,1 year (lifecycle),N/A,<0.001 kg,Least Concern,Stable,Southern Mexico through Central America to Peru and Bolivia,"Cattleheart butterflies sequester toxic aristolochic acids from their Aristolochia larval host plants, making themselves unpalatable to predators. Their bright colours advertise this toxicity, and they are mimicked by several non-toxic butterfly species.",Deforestation,The green-celled cattleheart is a stunning dark swallowtail. Its wings are velvety black above with brilliant green iridescent cells on the hindwing that appear to glow. Males have crimson patches on the hindwing underside.,,
